fetchingDate,creationDate,author,authorLink,articleLink,articleTitle,articleText
2025-05-21 03:04:40,"May 15, 2025",Dark Reading,https://www.darkreading.com,https://www.darkreading.com/vulnerabilities-threats/critical-sap-netweaver-vuln-cyberattacks,Critical SAP NetWeaver Vuln Faces Barrage of Cyberattacks,"As threat actors continue to hop on the train of exploiting CVE-2025-31324, researchers are recommending that SAP administrators patch as soon as possible so that they don't fall victim next.
Ransomware groups and Chinese advanced persistent threat (APT) groups are targeting a critical vulnerability in SAP NetWeaver weeks after it was disclosed and patched by the vendor through an out-of-band emergency update.The vulnerability, tracked as CVE-2025-31324, has a CVSS score of 10 and affects NetWeaver's Visual Composer development server. Threat actors can exploit the vulnerability using remote attacks to execute arbitrary code without authentication, which could potentially lead to a full system compromise.Cybersecurity vendor ReliaQuest first flagged CVE-2024-31324, which had been exploited as a zero-day vulnerability, on April 22. SAP issued emergency patches on April 24. However, exploitation has continued this month.Cyber Threats From All SidesResearchers at ReliaQuest noted that, at first, they suspected the vulnerability was a remote file inclusion (RFI) issue. ""However, SAP later confirmed it as an unrestricted file upload vulnerability, allowing attackers to upload malicious files directly to the system without authorization,"" the researchers wrote in an update on April 25.ReliaQuest had first detected malicious Web shell activity from unknown threat actors targeting NetWeaver instances. On May 2, the researchers posted another update stating that they were actively monitoring threat activity and gathering indicators of compromise related to the vulnerability.Related:Virgin Media 02 Vuln Exposes Call Recipient Location""As ReliaQuest continues our investigations into CVE-2025-31324, we've observed that these webshells are not confined to helper.jsp or cache.jsp; randomly named JSP files like rrx.jsp and dyceorp.jsp can also be found within NetWeaver directories,"" the researchers wrote.On May 8, researchers at Forescout Vedere Labs linked some of the ongoing attacks to a suspected Chinese threat actor they track as Chaya_004. The threat actor uses malicious infrastructure that includes ""a network of servers hosting Supershell backdoors, often deployed on Chinese cloud providers, and various pen testing tools, many of Chinese origin.""Additionally, EclecticIQ reported three other Chinese APTs — UNC5221, UNC5174, and CL-STA-0048 — that are also targeting the NetWeaver vulnerability.On May 14, ReliaQuest released their most recent update, which noted that recent threat reports tied the attack chain to China-linked threat actors.""However, continued analysis has uncovered evidence suggesting involvement from the Russian ransomware group 'BianLian' and the operators of the 'RansomEXX' ransomware family (tracked by Microsoft as 'Storm-2460'),"" the researchers added. ""These findings reveal widespread interest in exploiting this vulnerability across multiple threat groups.""Related:Why Rigid Security Programs Keep FailingReliaQuest added that BianLian was involved in at least one incident, and it observed a separate incident that featured ""PipeMagic,"" a modular backdoor linked to RansomEXX and delivered through MSBuild abuse.""The involvement of groups like BianLian and RansomEXX reflects the growing interest in weaponizing high-profile vulnerabilities for financial gain,"" the researchers warned. ""These developments emphasize the urgent need for organizations to immediately apply patches, monitor suspicious activity, and strengthen defenses.""Mitigating Against the MassesReliaQuest emphasized that CVE-2025-31324 has become ""a high-value target"" for multiple threat actors.Further complicating matters this week was the emergence of a second zero-day vulnerability in NetWeaver Visual Composer, disclosed and patched on May 12. The critical vulnerability, tracked as CVE-2025-42999, has a 9.1 CVSS score and was discovered through Onapsis Research Labs' investigation into the attacks on CVE-2025-31324.To mitigate against these threats, a patch was released for CVE-2025-31324 on May 13 along with 15 other patches for their respective vulnerabilities, including a second NetWeaver vulnerability that was chained to the attacks as a zero-day.Related:RSAC 2025: AI Everywhere, Trust NowhereTo prevent exploitation by threat actors, it's recommended that SAP admins patch their NetWeaver servers immediately. If patching is not possible, they should disable the Visual Composer service. They can also restrict access to metadata uploader services while monitoring for any suspicious or unauthorized activity on their servers.For organizations that suspect they may already have been compromised, ReliaQuest released a detection mechanism that looks for suspicious JSP Web shellsIf left unpatched or unmitigated, exploitation of CVE-2025-31324 can lead to service disruption, information leakage, credential interception, lateral movement, and regulatory noncompliance."
2025-05-21 03:05:14,"May 15, 2025",Dark Reading,https://www.darkreading.com,https://www.darkreading.com/vulnerabilities-threats/rsac-2025-ai-everywhere-trust-nowhere,"RSAC 2025: AI Everywhere, Trust Nowhere","We're at an inflection point. AI is changing the game, but the rules haven't caught up.
COMMENTARYWalking the show floor at RSAC 2025 felt a bit like stepping into a sci-fi movie. AI was everywhere: on banners, in pitches, onstage, and in the air. More than 25% of vendors in the North and South Expo Halls referenced AI in their company overviews. In the early stage expo, that number jumped to over 40%. If you didn't say ""AI,"" were you even at RSAC?But amid the buzzwords and booth lights, the real conversations — the ones happening inside rooms, hallway huddles, and post-panel coffees — told a different story. It's a story not just about what's next, but about what's broken now.A Letter That Lit a FireOne of the most talked-about moments wasn't a product announcement or a keynote. It was a letter.Pat Opet, chief information security officer (CISO) of JPMorgan Chase, published an open letter to vendors ahead of RSAC. His message was blunt: Get your act together. The letter called out the lack of reliability, accountability, and transparency from too many cybersecurity vendors, especially when it matters most. This resonated deeply with security leaders across sectors. For many, it put words to a frustration that's been simmering for years: We are spending more than ever on tools, and yet we still can't answer basic questions during an incident.Related:Virgin Media 02 Vuln Exposes Call Recipient LocationThe letter set the tone for RSAC 2025. It wasn't just about innovation. It was about trust.AI Is the Spark; Risk Is the FuelThe Microsoft session ""Accelerate AI Adoption with Stronger Security"" was a grounded take on the AI explosion. It acknowledged that AI is not just a productivity game-changer — it's a security risk multiplier.As enterprises race to embed generative AI into workflows, they're often deploying models and agents without fully understanding the data exposure, permissions, or downstream consequences. Microsoft's point was clear: AI doesn't exist in a vacuum. It lives on the same infrastructure, talks to the same APIs, and inherits the same vulnerabilities as everything else in your stack.This was echoed in ISACA's session, ""Vendor Vulnerability: Get Ahead of Third-Party AI Risk."" The panel dove into the differences between AI you build and AI you buy — and how both can introduce risk if teams can't see or govern what those systems are doing. One speaker asked a question that stuck with me: ""If an AI agent has access to your CRM, your cloud storage, and your ticketing system, but no one's monitoring those flows in real time … who's really in control?""That's the heart of the issue. AI isn't just a tool — it's a new kind of identity. And we're not ready for it.Related:Why Rigid Security Programs Keep FailingSkepticism in the AislesDespite the hype, not everyone was buying it. One security architect I spoke with was blunt: “Agentic AI sounds like one more bloody agent I have to manage. Agents add privacy and performance issues and increase my attack surface.""Many practitioners are already drowning in complexity — managing dozens of tools, thousands of alerts, and countless integrations. The idea of introducing autonomous digital workers with privileged access, opaque logic, and no oversight? It's raising alarms, not optimism.And they're right to be skeptical. AI security tools need to reduce complexity, not add to it. They need to provide visibility, not just automation. Otherwise, we're just accelerating into a wall.The Real Cost of NoiseIn a session led by Bloomberg Intelligence, the data was sobering. The number of breaches per incident has nearly tripled since 2019. Attackers are getting better — and faster. AI is supercharging phishing, lateral movement, and credential abuse. And yet, the vast majority of the alerts SOC teams receive are ignored and are still false positives.One speaker told the story of an AI company whose analysts spent four hours a day just triaging user-submitted phishing emails. Not stopping attacks. Not threat hunting. Just validating spam. That's the kind of inefficiency that AI should be solving — if we can trust it.Related:Critical SAP NetWeaver Vuln Faces Barrage of CyberattacksConsolidation Is ComingAnother theme at RSAC was platform consolidation. Bloomberg's analysis showed that hyperscale cloud providers and security platforms are doubling down on acquisitions — driven by customer fatigue with ""yet another tool."" The proposed acquisition of Wiz by Google was just one of several moves in this direction. Palo Alto Networks, which didn't exhibit this year, kicked off RSAC with an announcement it was acquiring Protect AI, a cybersecurity startup that helps enterprises secure their adoption of AI.But consolidation isn't just about bundling features. It's about simplifying risk. As regulation tightens (think the EU AI Act's potential 7% global revenue penalty for insecure AI systems), enterprises are looking for fewer vendors, clearer accountability, and integrated visibility.The question is whether vendors will rise to that challenge — or just repackage the same complexity under a shinier logo.What Happens Next?RSAC 2025 made one thing clear: We're at an inflection point. AI is changing the game, but the rules haven't caught up. Security leaders are looking for fewer dashboards, more context, and real answers when things go wrong.They want partners who are present during the breach — not just the pitch.They want tools that reduce noise, not create more of it.They want to know what their systems are doing, not just whether the config passed audit.Ultimately, they want to trust their stack.And right now, that trust is in short supply."
2025-05-21 03:05:57,"May 15, 2025",Dark Reading,https://www.darkreading.com,https://www.darkreading.com/endpoint-security/realdefense-partner-program-surpasses-100m-in-annual-revenue,RealDefense Partner Program Surpasses $100M in Annual Revenue,"
PRESS RELEASEPASADENA, CA – May 12, 2025 – RealDefense, a leader in consumer cybersecurity and device optimization, today announced that its newly launched Partner Program has surpassed $100 million in annual recurring revenue (ARR), demonstrating the power of SmartScan device telemetry to accelerate growth across the B2B2C ecosystem.Designed for software companies, cybersecurity vendors, telecom providers, and OEMs, the RealDefense Partner Program unlocks monetization through real-time, on-device insights – transforming everyday device signals into actionable engagement moments.“This isn’t just a reseller model – it’s a telemetry-powered growth engine,” said Gary Guseinov, CEO of RealDefense. “We enable our partners to deliver security, speed, and value at the exact moment users need help, and that’s what drives conversion, retention, and trust.”How It Works: Monetization Through SmartScan TelemetryAt the core of the program is RealDefense’s SmartScan technology, which analyzes performance, network behavior, file activity, and system health – entirely on-device, preserving user privacy.With SmartScan, partners can:Detect threats and performance issues without sending data to the cloudTrigger contextual “moment of truth” prompts to engage users in real-timeIncrease ARPU via intelligent upsells and value-added servicesStrengthen trust with privacy-first, performance-boosting toolsOne partner achieved a 44% click-through rate on SmartScan-triggered messages and a 2.4% conversion of free users to paid subscribers within a single quarter.Proven Results: Fast Time-to-ValueSince its launch, RealDefense partners have seen:$100M+ in new ARR from consumer software and telecom deployments50%+ trial-to-paid conversion rates85% renewal rates for integrated tools like System Mechanic®8-figure lifts for partners—without upfront licensing costsPartner ROI is driven by a seamless integration that adds revenue without disrupting existing business flows.Ideal PartnersThe RealDefense Partner Program is purpose-built for:Consumer software companies seeking better retention and upsell mechanicsCybersecurity platforms focused on growing ARPUTelecoms expanding value-added services and looking to increase subscriber stickinessOEMs and PC manufacturers needing pre-loaded solutions with minimal support impactTechnical support firms adding diagnostic and performance value to service callsBuilt for Scale and SpeedThe program includes:White-label solutions powered by sophisticated device optimizationFlexible monetization models: revenue share, license-based, and card-on-file trialsTurnkey integration, streamlined onboarding, and billing alignmentEnterprise-grade privacy and compliance protocols“Partners don’t need to rebuild their tech stack,” said Sean Whiteley, President of RealDefense. “We seamlessly integrate into their existing operations, delivering immediate value at scale.”Momentum and GrowthRealDefense’s Partner Program has helped fuel the company’s 267% growth over three years—earning it a spot on the Deloitte Technology Fast 500™. As digital privacy, optimization, and security become daily essentials, RealDefense is helping partners turn user needs into meaningful engagement and measurable revenue.Learn more at: https://www.realdefen.se/home/partners/ | Contact: partners@realdefen.seAbout RealDefenseRealDefense LLC, based in Pasadena, CA, protects privacy, secures devices, and boosts system performance for consumers and small businesses. Its brands include iolo System Mechanic®, SUPERAntiSpyware®, MyCleanPC®, and USTechSupport—trusted by millions worldwide.Through embedded partnerships with PC makers, cybersecurity platforms, and telecom providers, RealDefense delivers real-time, on-device intelligence that enhances user experience and drives new revenue streams. Its Partner Program has generated over $100 million in new annual revenue, with industry-leading conversion and renewal rates.A Deloitte Technology Fast 500™ company, RealDefense continues to scale its platform with a focus on privacy-first design, flexible integration, and measurable partner success."
2025-05-21 03:06:36,"May 15, 2025",Dark Reading,https://www.darkreading.com,https://www.darkreading.com/ics-ot-security/critical-infrastructure-ot-security-still-lags,Critical Infrastructure Under Siege: OT Security Still Lags,"With critical infrastructure facing constant cyber threats from the Typhoons and other corners, federal agencies and others are warning security for the OT network, a core technology in many critical sectors, is not powered up enough.
Operational technology and critical infrastructure are under attack, according to new warnings from the US federal government.Last week, the Cybersecurity and Infrastructure Security (CISA), the FBI, the Environmental Protection Agency (EPA), and the Department of Energy (DoE) warned that they were ""aware of cyber incidents affecting the operational technology (OT) and industrial control systems (ICS) of critical infrastructure entities in the United States.""As such, the authoring agencies published a fact sheet advising organizations to address basic security hygiene issues: removing OT connections from the public Internet; changing default passwords and using stronger unique ones; securing remote access to OT networks; segmenting IT and OT networks; and practicing the ability to maintain OT systems manually in case of an incident.Critical infrastructure is a broad term that accounts for 16 categories: chemicals, commercial facilities, communications, critical manufacturing, dams, defense industrial base, emergency services, energy, financial services, food and agriculture, government services and facilities, healthcare and public health, information technology, nuclear (reactors, materials, and waste), transportation, and water and wastewater. According to Fortinet's ""Global Threat Landscape Report"" for 2025, manufacturing was the most-targeted sector for ransomware last year, representing 17% of attacks. And in Dragos' 2025 ""Year in Review"" report released earlier this year, the vendor highlighted an 87% increase in ransomware attacks against industrial organizations year-over-year.Related:Many Fuel Tank Monitoring Systems Vulnerable to DisruptionA look at known specific attacks against critical infrastructure makes these figures no less alarming. You have the Colonial Pipeline ransomware attack in 2021, destructive cyberattacks in Ukraine perpetrated by Russia, Salt Typhoon's espionage campaign against major US telecom providers last year and continuing in 2025, Volt Typhoon's efforts to ""pre-position"" to disrupt physical processes in the event of a kinetic war with China, and much more.These attacks, dangerous as they are, aren't new; the Stuxnet virus was deployed in 2010 as a targeted attack against Iran's nuclear program. The US and Israeli governments have been accused of creating the virus as a kind of cyber weapon, though neither has taken responsibility.Most of the attacks have been against OT, the hardware and software that monitors and controls many kinds of physical devices; and ICS, which represents the systems that integrate industrial processes with network connectivity. Stuxnet, for example, targeted SCADA systems — a form of ICS. OT and ICS can be found in everything from chemical plants, to factories, to water treatment plants, to power plants and beyond.Related:AWWA Supports Introduction of Collaborative Cybersecurity LegislationIndustrial organizations and other kinds of critical infrastructure are regularly near or at the top of vendor lists highlighting ransomware targets. It's easy to see why; the important assets a threat actor could compromise put immense pressure on affected organizations to pay up. Kurt Gaudette, vice president of intelligence and services at Dragos, tells Dark Reading that the OT side of the house is ""where the bottom line is.""And indeed, Sophos reported last year that 65% of respondent organizations in the manufacturing sector reported that they suffered a ransomware attack in the year preceding the report; of those, 62% of organizations paid the ransom.Compounding this, the security postures of organizations that use OT/ICS can vary dramatically compared with traditional IT settings. The importance of staying patched is complicated by the reality that some industrial processes are meant to run uninterrupted for long periods of time and can't be subjected to the downtime necessary to patch. Second, an organization like a local water treatment plant might not have a significant security budget to invest in tools and personnel. Also, ICS products tend to be expensive, and aging equipment is everywhere, with many fields like healthcare drowning in legacy, hard-to-patch products or those without built-in security features.Related:If Boards Don't Fix OT Security, Regulators WillHow Are Defenders Doing?Fortinet global vice president of threat intelligence Derek Manky tells Dark Reading that ""organizations have been forced to realize in recent years that they're a target for attackers,"" thanks to a combination of OT being an opportunistic area for attackers as well as poor defender security postures.However, Manky argues we're a ways away from ""true operational technology security"" being applied at scale, despite options being available. ""With modern technology, we have very pragmatic approaches through network detection and response [NDR] as well as platform-agnostic tools, so you don't have to have embedded security running on some legacy controls,"" he says.Other available tools include machine learning-based products that can look for anomalous activity targeting protocols, as well as deception environments and advanced honeypots that act as attractive lures for attackers and opportunities to gain intelligence.Jeff Macre, industrial security solutions architect for Darktrace, says he has noticed a shift toward better governance at the company level.As he explains, IT departments would have dedicated staff for network and other traditional security areas, while on the OT side of the house, would generally have the same individuals running both operations and cybersecurity. Boards are now ""asking the hard questions"" about addressing OT on the other side of the house.This plays hand-in-hand with the idea of OT/IT convergence, where these two classically separate sides of an organization are starting to work together more, including on the security front. Macre explains that while this has been a point of discussion for a while, it is now ""actually starting"" in earnest.However, as Gaudette says, both sides of an organization have different needs. They should work and talk together, but companies should also understand where OT and IT diverge, such as when it comes to periods of downtime. And of course, network segregation is key so that threats like Volt Typhoon can't infiltrate IT systems and pivot to gain control over physical processes. Colonial Pipeline, after all, was attacked by way of its billing systems.The Attacker Angle for Critical InfrastructureManky says financially motivated attackers have also taken cues from nation-state attacks, such as Russia's use of wipers against Ukraine or the 2012 attack on Saudi Aramco. After these destructive onslaughts began, wipers were then added to OT-targeted cybercrime and ransomware kits.Adam Meyers, CrowdStrike's senior vice president of counter-adversary operations, says that critical organizations are keenly aware of the threats targeting them but face challenges in the speed at which threat actors move these days. He cites a CrowdStrike stat from last year that cyberattackers overall decreased their breakout time by 14 minutes on average, from 62 to 48 minutes, with the fastest being 51 seconds. That time tends to decrease every year.In addition to attacker speed, Meyers says the amount of data organizations have to process has gone way up in the era of Industry 4.0 and the rise of IoT sensors.""There's no relief for them,"" he explains. ""Critical infrastructure organizations take [threats] as seriously as they can, but they're resource constrained.""The Way Forward for OT SecurityThe good news is that the very real problems with OT security (and by extension critical infrastructure) are beginning to be addressed, slowly but surely.In March 2022, former President Biden signed into law the Cyber Incident Reporting for Critical Infrastructure Act of 2022 (CIRCIA). The law, in part, requires relevant critical infrastructure organizations to report covered cyber incidents to CISA within 72 hours of discovering that an incident occurred.Other government entities are acting too. During RSAC Conference 2025, representatives from research agencies including DARPA discussed how they were addressing industry-specific critical infrastructure issues. For example, ARPA-H spent millions of dollars funding research into a dedicated suite of tools for the healthcare industry, while ARPA-I is researching how automation can be used to stay on top of infrastructure security needs and updating legacy technology.For OT specifically, Macre says he would love to see technologies like core network monitoring applied more broadly in organizations. He adds that machine learning, from a security perspective, is suited to OT because industrial hardware can often be straightforward and ""easy to pattern.""Macre also wants to move away from the industrywide emphasis on asset visibility as being enough. He says that while it is important for organizations to know what they have, a full inventory is useless from a security perspective unless organizations take advantage of that visibility. All too often, critical infrastructure entities fail to take additional steps to, say, deploy more tailored threat intelligence, endpoint solutions, or other OT defenses based on the data.Overall, Dragos' Gaudette says he feels there's greater awareness surrounding OT because people see the threats as ""real"" now, albeit ""not near to the tune that I would be comfortable with from a national security perspective.""""Some verticals are much more mature than other verticals. The electric side of the house is a very mature vertical because there's been regulation associated with it,"" he says. ""Is it getting better overall? Yes. Is it getting better fast enough? No."""
