fetchingDate,creationDate,author,authorLink,articleLink,articleTitle,articleText
2025-05-21 02:49:50,"May 20, 2025",Dark Reading,https://www.darkreading.com,https://www.darkreading.com/threat-intelligence/fake-kling-ai-malvertisements-lure-victims,Fake Kling AI Malvertisements Lure Victims With False Promises,"Researchers noted that they found several similar websites, two of which are still operating and require the same kind of behavior on behalf of the victim.
NEWS BRIEFA threat actor mimicking popular AI media generation platform Kling AI is also driving traffic to a fake website through paid ads and counterfeit Facebook pages, according to researchers.The threat campaign directs users to a spoof of Kling AI's website, where visitors are invited to use the platform to create AI-generated images and videos.However, instead of delivering what the user requests, it instead offers a ""malicious 'image or video output' for download"" that carries extensions such as .mp4 or .jpg as a disguise but is actually a Window executable using double extensions and Hangul Filler characters to hide what it is, according to Jaromír Hořejší, a Checkpoint researcher. Users then end up launching a malware loader when they expect to preview what the fake AI has generated.According to the Checkpoint researchers, ""this executable utilized .NET Native AOT (Ahead-Of-Time) Compilation to complicate analysis"" and evade detection. ""Once executed, the loader staged and deployed follow-up payloads — primarily infostealers to exfiltrate browser-stored credentials, session tokens, and other sensitive data,"" they added.While the researchers note that they began tracking this campaign in early 2025, they have seen a possible evolution of malvertising campaigns impersonating Kling AI through several other similar-looking websites.They use domain names like klingxai[.]com, kingaitext[.]com, klingx[.]ai, and more. While most of the suspicious websites were already taken down by the time the researchers found them in their investigation, two were still up and required similar behavior on behalf of the victim.This isn't the first time security researchers have flagged this kind of malware tactic. Morphisec, a security vendor, detailed a similar campaign involving threat actors advertising ""AI-themed"" platforms on sites like Facebook that pretend to offer AI-generated images, videos, and more but really only end up loading malware like ""Noodlophile Stealer"" onto user devices."
2025-05-21 02:50:27,"May 20, 2025",Dark Reading,https://www.darkreading.com,https://www.darkreading.com/vulnerabilities-threats/virgin-media-02-call-recipient-location,Virgin Media 02 Vuln Exposes Call Recipient Location,"A hacker exploiting the security flaw in the mobile provider's network could have potentially located a call recipient with accuracy of up to 100 square meters.
NEWS BRIEFVirgin Media 02 (VMO2), the British mass media and telecommunications company, has patched a security vulnerability found in its 4G Calling and Wi-Fi Calling features.4G Calling is a voice-over-LTE (VoLTE) offering that launched in 2017 by O2 UK, prior to its merger with Virgin Media in 2021. It allows users to make calls using VoIP with an LTE connection instead of using traditional cellular signaling; Wi-Fi Calling allows VoIP over Wi-Fi, similar to Apple's FaceTime feature.The vulnerability allowed for a user to potentially determine the general location of the individual they were calling, according to researcher Daniel Williams. He said he was able to locate call recipients thanks to the services' signaling messages (SIP headers) containing excessive information, including: International Mobile Subscriber Identity (IMSI) values, which identify users through SIM cards; IMEIs, which are the serial numbers on each device; and cell ID headers, which are the numbers assigned to cell towers or network base stations.In some cases, he said, the location-tracking could theoretically be accurate up to 100 square meters, an area roughly the size of two football fields placed next to each other.Source: Dark Reading; visual created via Elysia AIWilliams said that the information could be inputted into publicly available tools, such as CellMapper, to gather information on a call recipient's location. And while most individuals wouldn't be able to access the location information, anyone with ""a basic understanding of mobile networking"" would be able to carry this out.Williams published his findings regarding the issue on May 17, but did not initially hear from VM02. A spokesperson from the mobile network operator yesterday, however, said in a media statement that the issue has since been resolved, and thanked Williams for his contributions.""Our engineering teams have been working on and testing a fix for a number of weeks,"" said the VM02 spokesperson. ""We can confirm this is now fully implemented and tests suggest the fix has worked and our customers do not need to take any action.""Williams said he independently verified that the vulnerability appeared to be resolved as of yesterday."
2025-05-21 02:51:01,"May 20, 2025",Dark Reading,https://www.darkreading.com,https://www.darkreading.com/cyber-risk/tenable-third-party-connectors-exposure-management,Tenable Adds Third-Party Connectors to Exposure Management Platform,"Tenable One now pulls in data from AWS, Microsoft, and competitors to provide a holistic security view of an organization's attack surface.
Tenable Security has announced the latest update to Tenable One, its software-as-a-service-based exposure management platform, featuring connectors to third-party data sources and the ability to create customized risk analysis dashboards. With the new release, Tenable One can now ingest telemetry from various systems of other vendors, including partners and competitors AWS, CrowdStrike, HackerOne, Microsoft, Palo Alto Networks, Qualys, Rapid7, and Wiz.""With this launch, we can pull non-Tenable products and non-pure preemptive and vulnerability management solutions into our platform and truly provide our customers with a holistic view and analysis of all their attack surface,"" says Tenable senior VP Amir Hirsh.Tenable One, launched in 2022 as one of the first exposure management offerings, is one of Tenable's fastest-growing new offerings. Although the company didn't disclose how many customers use its platform, during its Q1 2025 earnings call last month, co-CEO Steve Vintz said that Tenable One accounted for ""a sizable percentage"" — over 30% — for the period ending March 31.The third-party connectors are based on technology Tenable acquired earlier this year when it bought Vulcan Cyber. Tenable's leaders deemed the acquisition essential to advance Tenable One's exposure management capabilities beyond telemetry from its own products, including Tenable Vulnerability Management, Tenable Cloud Security, and Tenable Operational Technology Security.Related:Attackers and Defenders Lean on AI in Identity Fraud BattleWhile the Vulcan integration engine has over 100 connectors, Tenable has listed only 34 that are now built into TenableOne. Hirsh says the remaining, and new ones, will be incrementally released during the coming weeks and months, though he did not commit to when they will all be commercially available.Omdia principal analyst Andrew Braunberg credits Tenable for having some of its competitors in this first batch of connectors integrated into Tenable One, including its traditional vulnerability management rivals, as well as a host of endpoint protection vendors that use those tools as essential components of their exposure management solutions.""What is notably missing, however, is connectors to ITSM and threat intel vendors,"" Braunberg says. ""This potentially limits both remediation workflow support and more targeted prioritization of risk, which often relies on up-to-date context related to threat actor activity.""Hirsh, who is overseeing the integration of Vulcan technology into Tenable One, emphasized that all connectors will be integrated, barring any unforeseen technical obstacles.Related:Content Credentials Technology Verifies Image, Video Authenticity""We just didn't want to wait for the whole 100, so we started with the major ones that our customers were asking for, with the most popular ones first to be prioritized and covered,"" he says. ""We'll be releasing more connectors over the upcoming weeks to reach both all of the old Vulcan lifts and some additional connectors that Vulcan didn't have at the time.""Further, because the Vulcan integration engine is built on a no-code platform, creating new connectors with Tenable's meta language eliminates the need for extensive coding when creating new connectors and controllers. This lends itself to building new ones, Hirsh says.""We can add pretty fast any connector that you're going to throw at us,"" he notes. ""We can adjust. We need to learn the fields, etc., but we don't need developers to add that into the platform.""Customers and partners can also customize those connectors, Hirsh adds, ""because it's no-code. It isn't compiled in the system itself. They have an interface that allows them to do it themselves.""Tenable has also integrated Vulcan's BI analytics engine into the Tenable Exposure Data Fabric, designed to ingest, normalize, and link data across an organization's security silos. The new BI tool uses Tenable ExposureAI, a generative capability added to Tenable One in 2023 that is designed to alert teams of isolated risks and undiscovered attack paths. It prioritizes the most critical mitigations based on their potential impact on the organization.Related:Drata Acquires SafeBase to Strengthen GRC Portfolio""Within the Tenable console itself, they'll be able to view the existing reports that we provide out of the box and build their own custom reports within the interface,"" Hirsh says. This capability, he adds, eliminates the need to invest in separate BI tools and teams."
2025-05-21 02:51:36,"May 20, 2025",Dark Reading,https://www.darkreading.com,https://www.darkreading.com/data-privacy/regeneron-pledge-privacy-23andme-acquisition,Regeneron Pledges Privacy Protection in $256M Bid for 23andMe,"Regeneron's planned acquisition of 23andMe raises significant privacy concerns as experts warn about the lack of comprehensive federal regulations governing the transfer of genetic information.
Pharmaceutical company Regeneron Pharmaceuticals has announced plans to buy DNA testing firm 23andMe out of bankruptcy and pledged to maintain existing privacy practices that safeguard customers' genetic data.23andMe filed for voluntary Chapter 11 bankruptcy in March, along with plans to pursue a sale. Because its assets include genetic data and other sensitive information, an independent, court-appointed customer privacy ombudsman will need to review the Regeneron transaction to assess how the $256 million deal could affect the privacy of 23andMe customers. The report is due to the bankruptcy court by June 10, with a hearing set for June 17 to determine whether the acquisition can proceed.Regeneron said it was prepared to explain how it will use and protect the data to the ombudsman.""We assure 23andMe customers that we are committed to protecting the 23andMe dataset with our high standards of data privacy, security, and ethical oversight and will advance its full potential to improve human health,"" said Aris Baras, Regeneron's senior vice president, in a statement.The company stressed its experience with handling sensitive data, citing past work with the anonymized DNS sequences of nearly 3 million people.The bankruptcy filing and plan to be sold raised concerns among customers and privacy advocates over how a buyer would use the data. Experts were concerned that if the data is misused, individuals may be targeted or discriminated against based on their genomic profile and predisposition to disease. Related:The Dark Side of Digital: Breaking the Silence on Youth Mental HealthAccepted Terms and Conditions Extensive privacy policies and terms and conditions can be difficult for consumers to digest, notes Andrew Crawford, senior counsel for the Center for Democracy and Technology's Data and Privacy Project.""We've got very sensitive data held by entities that don't have a lot of federal regulations and laws dictating how they handle that data,"" Crawford says. ""It really is incumbent on each consumer in those spaces to do their homework. That homework can take a long time and, frankly, is really burdensome on consumers."" Part of the problem is that, unlike other types of sensitive health-related data, the Health Insurance Portability and Accountability Act does not apply because the regulation does not cover genetic data.The privacy concerns surrounding 23andMe's bankruptcy filing are valid, says Franco Giandana Gigena, policy analyst at Access Now.""While 23andMe claims this data has been anonymized and customers have the option to permanently delete their records, the company has failed to secure their digital infrastructure in the past, with a notable data breach in October 2023,"" Gigena says. Related:NIST Updates Privacy Framework With AI and Governance RevisionsIf the data is mishandled, Gigena worries that customers could be targeted, discriminated against, stigmatized, or subjected to other forms of violence due to the biological nature of the data.""Depending on who ends up processing the data stored by 23andMe, there are different possible scenarios of data misuse, including for segmented advertisement and nonconsensual use of sensitive personal data for product development,"" Gigena says.   23andMe and Regeneron stated their commitments to user privacy, but the US doesn't have comprehensive federal laws that hold private companies that collect health data to account. Legally, the companies' primary obligations are to shareholders, the bankruptcy court, and any contractual obligations to customers, says Adam Marrè, CISO at Arctic Wolf. ""While I hope the company will act ethically and in the best interest of its customers, the outcome of the proceedings — and any future ownership — could influence how that plays out,"" he says. ""If any current or former customers are concerned about their data and privacy, I would strongly recommend deleting their information from their platform.""Related:NIST Finalizes Differential Privacy Rules to Protect DataGigena agrees.""This is yet another example of why the US needs to adopt strong privacy laws,"" he says. ""The 23andMe saga should strengthen the call for privacy protecting laws."""
2025-05-21 02:52:14,"May 20, 2025",Dark Reading,https://www.darkreading.com,https://www.darkreading.com/cyberattacks-data-breaches/bumblebee-malware-trojanized-vmware-utility,Bumblebee Malware Takes Flight via Trojanized VMware Utility,"An employee inadvertently downloaded a malicious version of the legitimate RVTools utility, which launched an investigation into an attempted supply chain attack aimed at delivering the recently revived initial-access loader.
Attackers have Trojanized a widely used VMware utility to execute a supply chain attack ultimately aimed at delivering the recently revived Bumblebee initial-access malware.Researchers from Arctic Wolf observed the attack — which abuses RVTools, a trusted VMware environment reporting utility — when an employee inadvertently attempted to install a malicious version of the tool in a customer's environment, according to separate blog posts by both Arctic Wolf and ZeroDay Labs.ZeroDay Labs' security operations team discovered the attack on May 13, when Microsoft Defender for Endpoint sent an alert for a suspicious file, version.dll, which was attempting to execute from within the same directory as the installer itself. According to a ZeroDay Labs post on the attack, upon examination of the file, the researchers realized it was an installer for the Bumblebee malware, which is widely used by cybercriminals to break into corporate networks.Bumblebee Flies AgainBumblebee typically is used as an initial-access loader to drop various payloads like infostealers, banking Trojans, and post-compromise tools, and was first detected by Google Threat Analysis in 2022. Though it was one of the targets of a Europol takedown called Operation Endgame in mid-2023, it has since been making a comeback.Related:Coinbase Extorted, Offers $20M for Info on Its HackersArtic Wolf researchers discovered that the flagged file had been downloaded via a malicious typosquatted domain that mimics the legitimate domain for acquiring RVTools, which is developed by Robware. The only difference was that the legitimate domain is a .com, while the malicious domain is a .org, according to the Artic Wolf post. Meanwhile, ZeroDay Labs reported that the official RVTools website was likely compromised to deliver the malicious installer.In either case, ""once the malicious installer is downloaded, the installer attempts to make outbound connections to known command and control infrastructure,"" Arctic Wolf threat intelligence researcher Andres Ramos wrote in the post, adding that researchers intercepted and sinkholed those attempts, preventing additional analysis on the final payload.Supply Chain Hack SpottedOnce discovering the malicious file, the ZeroDay Labs team uploaded the file to VirusTotal, revealing that 33 out of 71 antivirus (AV) engines detected it as a malicious variant of Bumblebee. While the file appeared to contain normal RVTools functionality, further investigation revealed a mismatch between the file hash listed on the RVTools website and the actual file being downloaded. The downloaded version was significantly larger and Trojanized with the malicious version.dll, while older versions of RVTools did not contain this file and matched their published hashes correctly.Related:Turkish APT Exploits Chat App Zero-Day to Spy on Iraqi KurdsThe discovery of the altered file's malicious nature was concerning, as the distribution of such a widely used tool masquerading as a legitimate version seemed to indicate that those behind the attacks were attempting a ""targeted supply chain compromise,"" Leon wrote, wherein cyberattackers could infect many systems, then cherry-pick which ones to further attack with additional payloads.About an hour after ZeroDay Labs' VirusTotal submission, the number of public submissions rose from four to 16, and the RVTools website went temporarily offline around the same time, Leon added. ""When it came back online, the download had changed: the file size was smaller, and the hash now matched the clean version listed on the site,"" he wrote.Though RVTools has since restored a clean version of its installer to the RVTools.com website, both that site and Robware.net were down on Monday when the Artic Wolf post went live, and they remain so on Tuesday. A message on the Robware.net site said that administrators are working ""expeditiously to restore service,"" but did not say when that would happen.Related:Hacktivists Make Little Impact During India-Pakistan ConflictAdvice to Avoid Cyber CompromiseBoth Arctic Wolf and ZeroDay Labs recommend that any organization that has recently downloaded RVTools verify the legitimacy of its installer, as well as review any execution of version.dll from user directories.Going forward, Leon also recommended that anyone downloading software onto a corporate network ""always verify hashes, especially when installing them from unofficial mirrors or if the vendor lacks code signing.""Moreover, given Robware's assertion that Robware.net and RVTools.com are the only authorized and supported websites for RVTools software, anyone attempting to download RVTools should avoid searching for or downloading it from any other websites or sources, ""including those with similar domain names,"" Ramos cautioned."
2025-05-21 02:52:49,"May 20, 2025",Dark Reading,https://www.darkreading.com,https://www.darkreading.com/threat-intelligence/large-retailers-scattered-spider-ransomware-web,Large Retailers Land in Scattered Spider's Ransomware Web,"The threat group games IT help desks to gain entry into retailer networks, and signs show it has shifted its attention from the UK to US targets.
Large retailers across the UK and US experiencing a high volume of calls into IT help desks regarding password resets might want to consider that they have a Scattered Spider cyberattack on their hands.Fancy French fashion house Dior has joined the growing list of retailers falling victim to cyberattacks in recent weeks. The hack comes on the stilettos of previous breaches of Harrods, the Co-Op Group, and Marks & Spencer. Dior was compromised on May 7, and the attackers made off with the sensitive data of an undisclosed number of customers across China and South Korea.The group broadly assumed to be behind the recent spate of cyberattacks is a loosey-goosey affiliation of English-speaking cybercriminals called Scattered Spider, also tracked as UNC3944. Known for brazenly calling up and scamming IT help desks into handing over credentials, this threat actor collective has racked up big hacks, most notably Las Vegas casinos MGM Resorts and Caesars Entertainment in 2023.Alleged members of the Scattered Spider group have been arrested, but that doesn't appear to have dampened the group's cybercrime ambitions.Now it's 2025, and retail has become the sector of the moment for Scattered Spider. The group also swapped out its ransomware-as-a-service (RaaS) operation, trading in ALPHV/BlackCat for DragonForce. Members of the RaaS group claimed responsibility for the attacks on Marks & Spencer, Harrods, and the Co-Op Group, though it's unclear what role Scattered Spider actors may have played.Related:Fake Kling AI Malvertisements Lure Victims With False PromisesResearchers following the group have warned that suspected Scattered Spider adversaries have made a distinctive pivot from the UK to US retailers, based on recently observed malicious activity. On May 14, Google Threat Intelligence Group chief analyst John Hultquist raised eyebrows by posting a link on X to Google Mandiant threat intel on Scattered Spider, along with the ominous caption, ""Shields up US retailers. They're here.""Retail Is Just the Latest Scattered Spider TargetIt's not so much the retailer data the group is after; it's notoriety along with a payday, Hultquist explains. And the group can also be wily and unpredictable.""This actor has a history of focusing their efforts on a single sector at a time, but we've also seen them abandoning an operation in the middle of an intrusion and switching their focus to a different victim in a completely unrelated industry,"" Hultquist says. ""A part of what they want to do is to gain clout, and that can come from targeting any industry.""Related:Novel Phishing Attack Combines AES With Poisoned npm PackagesBrands like Dior and Harrods are also household names, maximizing their media impact as well, says Tim Rawlins, senior advisor and director at NCC Group. Experts also point out that retailers have historically operated with an underprotected software supply chain.""The breaches we're seeing today often come from weaknesses that have been there for years,"" Dray Agha, operations manager with Huntress, says. ""What's new is that attackers are now seemingly going after them more deliberately. These aren't random hits anymore; cybercriminals are picking targets they know are vulnerable and profitable.""Huntress has also observed the Scattered Spider attackers — who, it adds, are purely financially motivated — using phishing and credential abuse to either deploy ransomware or steal data, Agha notes.Organizations can't predict when or if they will be the next Scattered Spider victim, so they need to take proactive measures to counter social engineering. This includes verifying callers, taking password resets out of the IT help desk, and using tools like Microsoft Entra self-service password reset (SSRP), which requires both multifactor verification and a secret passphrase for authentication, according to Rawlins. He also suggests using Slack or Teams to confirm a password reset.Related:'Operation RoundPress' Targets Ukraine in XSS Webmail Attacks""The good news is there are typically multiple opportunities to detect and/or deter this threat actor,"" Hultquist adds. ""Currently, this threat actor is mostly calling help desks to reset passwords, so organizations should inform their users to reject unexpected MFA prompts, but also report that activity immediately."""
