fetchingDate,creationDate,author,authorLink,articleLink,articleTitle,articleText
2025-05-21 03:12:57,"May 13, 2025",Dark Reading,https://www.darkreading.com,https://www.darkreading.com/vulnerabilities-threats/windows-zero-day-bug-exploited-browser-rce,Windows Zero-Day Bug Exploited for Browser-Led RCE,"Microsoft's May 2025 Patch Tuesday update also contains four other actively exploited zero-day security vulnerabilities, two publicly known bugs, and 12 critical patches.
A Microsoft scripting engine vulnerability has been exploited as a zero-day in the wild, leading to unauthenticated attackers achieving remote code execution (RCE).Microsoft hasn’t released any details on the scope or nature of the attacks but said that the bug (CVE-2025-30397, CVSS 7.5) is a memory corruption issue that can be exploited by convincing a user of the Edge browser in IE mode to click a specially crafted link on a malicious webpage or in an email.  ""This bug is interesting in that it forces Edge into Internet Explorer mode, so the ghost of IE continues to haunt us all,"" said Dustin Childs, head of threat awareness at Trend Micro's Zero-Day Initiative (ZDI), in his Patch Tuesday analysis. ""Microsoft provides no information on how widespread these attacks are, but I would go ahead and test and deploy this fix quickly.”In the event that patching isn't possible to handle immediately, organizations should ""disable Internet Explorer 11 as a stand-alone browser using administrative templates in Group Policy,"" Ryan Braunstein, security manager at Automox, wrote in an analysis. He also advised ""beginning migration planning if business-critical applications still require IE mode; and educate your users — phishing awareness and training are your first line of defense.”Related:Virgin Media 02 Vuln Exposes Call Recipient LocationIn all, there were 75 new CVEs this month, with 12 of them listed as critical and two being publicly known but not yet exploited.Four Microsoft EoP Zero-Days Actively ExploitedCVE-2025-30397 is one of five actively exploited zero-days listed in Microsoft's May 2025 Patch Tuesday update, all rated ""important."" The other four are all elevation-of-privilege (EoP) flaws in various Windows components that allow privilege escalation to SYSTEM (CVE-2025-30400, CVE-2025-32709, CVE-2025-32701, and CVE-2025-32706).""These bugs … are usually paired with a code execution bug to take over a system,"" Childs explained. ""All of the EoP bugs are commonly used in phishing and ransomware, so don't let their lower severity fool you. Definitely test and deploy these patches quickly.""Satnam Narang, Tenable's senior staff research engineer, noted that both CVE-2025-32701 and CVE-2025-32706 affect the Windows Common Log File System (CLFS) Driver for Windows.""This is the second month in a row that a CLFS elevation of privilege flaw was exploited in the wild as a zero-day,"" he wrote in an emailed statement. ""CVE-2025-29824, which was patched in April 2025, was exploited by a threat actor known as Storm-2460 [aka the Play ransomware gang] that used the PipeMagic malware to deploy ransomware in compromised environments.""Related:Why Rigid Security Programs Keep FailingIt's likely, he added, that CVE-2025-32701 and CVE-2025-32706 are part of post-compromise activity aimed at espionage or ransomware deployment.And finally, CVE-2025-32709 (CVSS 7.8) is an EoP flaw in afd.sys, the Windows Ancillary Function Driver that interfaces with the Windows Sockets API (or WinSock) to enable Windows applications to connect to the Internet.""We also saw this component exploited in the wild back in February of this year,"" ZDI's Childs said. ""When we see the same component exploited again and again, I begin to question the quality of the patches and wonder if they are being bypassed. Again, we have a privilege escalation bug here leading to SYSTEM privileges.""Critical Patching ConcernsOf the 12 critical vulnerabilities disclosed in May, researchers flagged CVE-2025-29967 (CVSS 8.8) as one of the most concerning. IT allows near-instant RCE via Remote Desktop Client.It's a ""high-risk threat for environments running Remote Desktop Protocol (RDP) in production,"" said Mat Lee, senior security engineer at Automox, who added that it could be combined with past RDP vulnerabilities to create chained exploits for instant system access. ""When a user connects to an attacker-controlled RDP server, the server can execute code on the client machine immediately upon session start, with no further interaction required.""Related:Critical SAP NetWeaver Vuln Faces Barrage of CyberattacksOther CVEs that should probably be prioritized include a critical RCE bug in Office (CVE-2025-30377, CVSS 8.4) that can be exploited via the Preview Pane with no user interaction required.On the cloud front, ZDI's Childs also pointed out that ""there are some scary-looking bugs in Azure,"" including a max-critical CVSS 10, ""but these bugs have already been mitigated by Microsoft, so there's no further action to take.""Other Microsoft May 2025 Security Bugs of NoteAn important-rated EoP vulnerability in NTFS (CVE-2025-32707, CVSS 7.8) targets how NTFS handles mounted virtual drives, such as VHD files.""If a user mounts a malicious disk image — often delivered via phishing emails or disguised as software installers — an attacker can gain elevated privileges on the host system,"" Automox's Braunstein wrote. ""This vulnerability presents a significant risk, especially when combined with user behaviors like mounting disk images from unverified sources.""Visual Studio, meanwhile, contains an important-rated RCE vulnerability that's already publicly known (CVE-2025-32702, CVSS 7.8) that Lee said poses a significant cyber-risk to developer systems that give access to sensitive assets like cloud credentials or build pipelines.""An attacker can exploit this flaw to run arbitrary code locally, potentially compromising software supply chains,"" he explained. ""This vulnerability has the potential of being especially dangerous in engineering environments, where developers often hold broader permissions than standard users. In combination with other known vulnerabilities — such as Remote Desktop Gateway flaws, this CVE could be part of a chained exploit, giving attackers fast, privileged access with minimal interaction."""
2025-05-21 03:13:31,"May 13, 2025",Dark Reading,https://www.darkreading.com,https://www.darkreading.com/cyberattacks-data-breaches/chinese-actor-taiwanese-drone-makers-supply-chains,"Chinese Actor Hit Taiwanese Drone Makers, Supply Chains","Tidrone concentrated on military entities and the satellite sector, using their associated service providers and ERP software to infect not just drones but all the entities that are part of their supply chains.
The Chinese-speaking threat group Earth Ammit targeted a broader range of industries than just Taiwanese drone manufacturers, as initially assumed.In a report last year, Trend Micro detailed an Earth Ammit campaign dubbed Tidrone that, at the time, it believed specifically targeted military and satellite-related industrial supply chains and drone manufacturers.Broader and More Sustained Than ThoughtThe security vendor's subsequent and continuing analysis of the campaign showed it was broader and affected companies in several other industries as well. These included heavy industry, media, technology, software services, healthcare, satellite and military-adjacent supply chains, and payment service providers in both South Korea and China.In addition, the attacks on these industries occurred in two distinct waves: the first was the previously reported Tidrone campaign, and the second — until now unreported — involved a campaign Trend Micro is tracking as ""Venom,"" which largely targets upstream software providers to companies in the threat group's sectors of interest. The threat actor's goal was to compromise trusted software vendors and service so it could target their high-value downstream customers.""Earth Ammit's long-term goal is to compromise trusted networks via supply chain attacks, allowing them to target high-value entities downstream and amplify their reach,"" Trend Micro researchers Pierre Lee, Vickie Su, and Philip Chen wrote in a report this week. ""Organizations that fall prey to these attacks are also at risk of data theft, including exfiltration of credentials and screenshots.""Related:Bumblebee Malware Takes Flight via Trojanized VMware UtilityEarth Ammit actors targeted software vendors and service providers as a way to reach targets. In attacks on software vendors, the threat actor tried to inject malicious code into legitimate software products and updates, which then got deployed to downstream customers, as happened in the SolarWinds attack. In attacks on service providers, the threat group breached systems belonging to technology service providers and then used remote monitoring and IT management tools to breach systems belonging to their customers.""Venom and Tidrone had related but distinct missions,"" says Stephen Hilt, senior threat researcher at Trend Micro. ""Both were conducted by Earth Ammit and focused on compromising entities involved in the drone supply chain, but they differed in execution and target scope,"" he says. Venom, active from 2023 to 2024, targeted a wide array of upstream vendors to indirectly infiltrate downstream high-value targets through trusted relationships. In contrast, Tidrone, observed in 2024, directly targeted military and satellite organizations in Taiwan, leveraging compromised service providers and ERP software to deploy espionage-focused malware, indicating a more direct and specialized approach, he says.Related:Coinbase Extorted, Offers $20M for Info on Its HackersThe Venom CampaignTrend Micro described the Venom campaign as being active between 2023 and early 2024. During this phase, Earth Ammit actors mostly used hard-to-detect, hard-to-attribute open source tools and living-off-the-land techniques to gain access to systems belonging to service providers, and from there, targeted downstream customers. In many instances they exploited Web server vulnerabilities to gain initial access and then uploaded Web shells that allowed them to break into systems belonging to the software provider's customers. Earth Ammit threat actors established command-and-control (C2) channels using open source proxies and achieved persistence via remote-access Trojans (RATs), Trend Micro said.The only custom tool that Earth Ammit deployed in the Venom campaign was a customized version of the open source Fast Reverse Proxy Client (FRPC), dubbed VENFRPC, that the threat actor used to enable covert remote access and C2 tunneling.Related:Turkish APT Exploits Chat App Zero-Day to Spy on Iraqi Kurds""In the Venom campaign, Earth Ammit targeted upstream vendors from sectors that frequently maintain trusted connections with downstream clients,"" Hilt says. These included organizations in heavy industry, media, technology, software services, and healthcare. ""By compromising these entities, Earth Ammit aimed to exploit their established relationships and communication channels to insert malware that could travel downstream to more strategically valuable targets, such as companies involved in the drone and defense supply chain.""The Tidrone CampaignEarth Ammit used a more complex three-phase infection chain in its Tidrone campaign, Trend Micro's analysis showed. For initial access, the threat actor went after service providers to organizations in targeted industries and then injected malicious code on systems belonging to their customers.For C2, the adversary used a custom tool to load two different payloads on compromised systems: previously reported backdoors called CXCLNT and CLTEND that Earth Ammit relied on for cyber espionage. Post-compromise, Earth Ammit engaged in a variety of malicious activities consistent with its goal of gathering intelligence from victim environments. These included privilege escalation via User Account Control (UAC) bypass; persistence via scheduled tasks and enabling auto-run; and credential dumping and disabling antivirus and malware detection tools.Tidrone concentrated specifically on entities related to the military and satellite sectors, Hilt says. It involved the compromise of service providers and ERP software to deliver payloads directly into drone manufacturing and defense organizations, showing a more targeted and streamlined supply-chain attack aimed at high-value national security-related targets, he adds.Trend Micro's report did not speculate on Earth Ammit's objectives in stealing data from drone manufacturers and companies in other industries. But typically the goal in these and most other Chinese state-sponsored cyber espionage has to been to bolster China's economic and military capabilities amid rising regional and global tensions. Additionally, such espionage could help China assess its adversaries' capabilities in emerging technologies like drones and autonomous weapons in the Asia-Pacific region."
2025-05-21 03:14:12,"May 13, 2025",Dark Reading,https://www.darkreading.com,https://www.darkreading.com/vulnerabilities-threats/eu-bug-database-vulnerability-tracking,What Does EU's Bug Database Mean for Vulnerability Tracking?,"The EU cyber agency ENISA has launched its vulnerability database, the EUVD; security experts shared their thoughts regarding what this means for CVEs, as well as the larger conversation around how bugs are tracked.
There's a new vulnerability database in town, and experts differ on how much its presence is going to affect the bug-tracking landscape.The European Union's cyber agency, ENISA, on May 13 launched its European Vulnerability Database (EUVD), a CVE Numbering Authority (CNA) that was introduced in beta last year as part of the EU's NIS2 Directive. Although it's technically still in beta, ENISA announced in a press release today that the EUVD is ""operational.""The database's website includes three sections, dedicated to critical vulnerabilities, exploited vulnerabilities, and EU-CSIRT coordinated vulnerabilities. The EUVD has its own proprietary numbering system that is similar to CVE (using ""EUVD-year-designation"" formatting), but listings also include equivalent CVEs and CVSS scores.According to the press release, ""the objective of the EUVD is to ensure a high level of interconnection of publicly available information coming from multiple sources such as CSIRTs, vendors, as well as existing databases."" It added that as an interconnected database, the EUVD will integrate with the open source bug-correlation software Vulnerability-Lookup.ENISA will gather feedback in the coming months, and ""2025 will be dedicated to further improve and develop the EUVD and all related services.""Related:Virgin Media 02 Vuln Exposes Call Recipient LocationElephant in the Room: MITRE's Unstable FundingThe elephant in the room here is, undoubtedly, the funding — or lack thereof — of MITRE’s CVE program. CISA's contract with the company to manage the CVE program was set to run out on April 16, but in the eleventh hour, CISA extended funding for another 11 months. MITRE's CVE program is and has been the foremost authority in vulnerability tracking, seen as an invaluable resource for the cybersecurity community as a whole.EUVD is not the first alternative in this space, as private and public entities have created alternative and complementary options to the primary CVE program over the years. And it's not necessarily a competition — more intelligence sources are generally better than fewer. But it must be said that this launch is happening amid MITRE funding woes, CISA cuts, and a series of other issues regarding US cyber policy in recent months.In a poll, Dark Reading recently asked 1,504 respondents what the future of the CVE system should look like. Four hundred ninety-nine said the system needs to be more efficient; 422 said it should shift to industry-run rather than government-run; 377 said there was no need to change it; and 206 said we should scrap it as it ""gives attackers too much information.""Related:Why Rigid Security Programs Keep FailingAs a companion to these results, Dark Reading asked security experts about the launch of the EUVD, how much its rollout is informed by recent US cyber turmoil, and what the future of CVE-style authorities will be.How MITRE Funding Informs EUVD's LaunchIn its press release, ENISA cited MITRE funding issues directly, saying that in order to meet NIS2 Directive requirements, it cooperated with international organizations including MITRE. Specifically, ""ENISA is in contact with MITRE to understand the impact and next steps following the announcement on the funding to the Common Vulnerabilities and Exposures Program.""Dark Reading contacted ENISA to ask whether issues surrounding the funding played into the EUVD's rollout, but the agency did not respond by the time of publication.Ryan Leirvik, CEO of offensive security firm Neuvik, explains to Dark Reading that there's no indication that EUVD was rolled out sooner than expected, although ""when partnership relationships become less reliable (even if the decrease in reliability is only perceived), self-reliance typically increases.""Ferhat Dikbiyik, chief research and intelligence officer at third-party risk security vendor Black Kite, notes that although the EUVD has been in motion for some time, ""it is hard to ignore the context around it.""Related:Critical SAP NetWeaver Vuln Faces Barrage of Cyberattacks""With recent CISA budget cuts and questions raised about CVE funding, the reliability of key US-led cybersecurity infrastructure has become less certain,"" Dikbiyik explains. ""That uncertainty can push others to act. Europe has long wanted more autonomy in areas tied to digital security, and this move fits that pattern.""He adds that while the EU is not trying to break away from the global security community, ""it is clearly positioning itself to be less dependent.""Similarly, Joe Nicastro, field chief information security officer (CISO) at Legit Security, says ""it's no surprise Europe is fast-tracking the roll out of their own vulnerability database.""""It makes sense not only from a sovereignty perspective for the EU. I also think it's a smart move to reduce reliance on a single system whose future funding and viability isn't clear,"" Nicastro says. ""Having had the opportunity to meet with Hans de Vries, COO for ENISA, while at RSAC this year and chat about this very topic, it sounds like the ultimate goal is for these two systems to work closely together to provide redundancy to the CVE and CWE ecosystems, as opposed to being a replacement.""The Future of Central Vulnerability DatabasesAs stated, the vulnerability database landscape is a complex one, with a number of public and private offerings for various technology use cases.For example, there have been multiple attempts at a database for cloud vulnerabilities, which generally don't get CVEs because they don't usually require user action. In the private sector, Flashpoint offers a product known as ""VulnDB"" — originally part of Risk Based Security before Flashpoint acquired the company in 2022 — that emphasizes providing a living vulnerability dashboard for customers.Flashpoint vulnerability historian Brian Martin says the company has ""long anticipated the need for more agile, independent alternatives to legacy vulnerability systems,"" and that EUVD ""reinforces our belief that semi-centralized models like CVE are no longer sufficient.""""The emergence of alternatives, such as EUVD, is a natural outcome of the security community recognizing those same gaps,"" Martin says.Black Kite's Dikbiyik meanwhile says the launch of EUVD reflects ""a growing understanding that critical systems like vulnerability coordination should not rest entirely on one country or one funding source.""The presence of another CVE database is not inherently negative, but it's worth noting that CVEs are not the end-all and be-all of the global security landscape either, according to David Lindner, CISO of vendor Contrast Security.""The existence of alternatives like China's CNNVD already signals a fragmented landscape,"" he says. ""The long-term impact for CISOs will be navigating multiple sources to gain a holistic understanding of vulnerabilities, requiring more sophisticated intelligence gathering and analysis.""Some, however, are more critical of EUVD's impact on the fragmented vulnerability database space.""The European Vulnerability Database feels like slapping another layer of bureaucracy onto an already crowded field,"" says Chetan Conikee, co-founder and chief technology officer (CTO) of application security vendor Qwiet.ai. ""Sure, aggregating vulnerability data sounds nice in theory, but in practice? Another database to check, another system to integrate, another set of standards to reconcile. Security teams are already drowning in alerts from multiple sources. Adding EUVD to the mix won't magically fix fragmentation — it might worsen it.""Thus, he says, better standardization of existing systems is needed rather than ""another silo.""While how it all shakes out remains to be seen, some see the EUVD's commitment to alignment across numbering authorities to be a mark of the future. Legit's Nicastro, for instance, says he respects that EUVD has mapped its nomenclature at least in part to CVE IDs, ""which shows they're thinking about practicality and interoperability, not just politics."""
2025-05-21 03:14:47,"May 13, 2025",Dark Reading,https://www.darkreading.com,https://www.darkreading.com/threat-intelligence/cisa-warns-telemessage-vuln-low-cvss-score,CISA Warns of TeleMessage Vuln Despite Low CVSS Score,"Though the app claims to use end-to-end encryption, hackers have reportedly accessed archived data on the app's servers via a new vulnerability.
NEWS BRIEFThe Cybersecurity and Infrastructure Security Agency (CISA) is warning users of a privacy vulnerability under exploitation in the messaging application TeleMessage — the very same one used by Michael Waltz, former national security adviser to President Donald Trump.TeleMessage makes modified versions of popular messaging applications such as Signal, WhatsApp, Telegram, and WeChat. TeleMessage's knockoff Signal app, known as TM SGNL, looks identical to the authentic version of Signal. The only difference is that it archives copies of every message ""to a destination determined by the TeleMessage customer.""This is according to information security and software engineer Micah Lee, who posted an analysis of the weakness on his blog and asserted that the app uses ""misleading marketing"" because it claims to support end-to-end encryption, when it actually doesn't.TM SGNL operates on a server hosted on AWS cloud that not only has plaintext access to the Signal chat logs they’re archiving, but also the chat logs of Telegram, WeChat, and WhatsApp. This is because TM SGNL is interoperable with Signal, Lee explained, meaning that when a user registers as a new account with TM SGNL, they're registering it with the official Signal server, allowing them to send messages to true Signal users and vice versa.""If you're a Signal user, you have no way of knowing when you're talking to a TM SGNL user, because the apps are nearly identical and use the same infrastructure,"" wrote Lee in the post. ""This is how Mike Waltz could accidentally add The Atlantic editor-in-chief Jeffrey Goldberg to a group chat where they discussed bombing an apartment building full of civilians: Waltz was presumably using TM SGNL, and Goldberg was presumably using Signal.""While the aforementioned leak occurred due to an error made by a user, hackers could exploit the lack of end-to-end encryption on TM SGNL and obtain user data from TeleMessage's archive server.The vulnerability, tracked as CVE-2025-47729 is still undergoing analysis by the National Institute of Standards and Technology (NIST) but has been assigned a CVSS score of 1.9. Despite this low severity score the security issue has been exploited in the wild by hackers who have obtained user data from the TeleMessage archive server, such as private Telegram messages. CISA added the flaw to its Known Exploited Vulnerabilities (KEV) catalog on Monday.As for users, there isn't much they can do on their end at this time to mitigate the flaw until it's addressed on the server-side, beyond discontinuing their use of the product."
