fetchingDate,creationDate,author,authorLink,articleLink,articleTitle,articleText
2025-05-21 02:56:05,"May 19, 2025",Dark Reading,https://www.darkreading.com,https://www.darkreading.com/threat-intelligence/gottumukkala-cisa-deputy-director,S. Dakota CIO Gottumukkala Signs on as CISA Deputy Director,"The addition is an important hire for the No. 2 position at the cyber agency. The main director role remains unfilled post-Easterly, with Bridget Bean taking over acting duties for now.
NEWS BRIEFThe US Cybersecurity and Infrastructure Security Agency (CISA) has installed a new deputy director, Madhu Gottumukkala.Gottumukkala most recently served as commissioner and chief information officer (CIO) for South Dakota’s Bureau of Information and Technology, overseeing statewide technology and cybersecurity initiatives. Prior to that, he served as South Dakota's chief technology officer (CTO), focused on modernization and replacing outdated legacy systems, and has held multiple senior and leadership-level IT roles across a broad range of enterprise technology areas.Gottumukkala will shore up the leadership team at CISA, reporting to the acting executive director of the agency, Bridget Bean. Bean is head cheese at the agency for now, in the absence of leadership since Jen Easterly stepped down from the role on Inauguration Day, Jan. 20. For now, the top position at CISA remains unfilled.Madhu Gottumukkala being sworn in at CISA. Source: CISAA void at the top isn't new: Easterly herself filled an eight-month vacancy left by President Trump's firing of the first CISA director, Chris Krebs, after he debunked false claims that the 2020 presidential election was stolen by President Biden. But Gottumukkala's appointment is especially welcome amid various layoffs and cuts to CISA more broadly.""I am honored to be appointed by Secretary Noem to serve as deputy director of CISA,"" Gottumukkala said in a statement. ""As a former state and local leader, I have seen firsthand the exceptional work CISA does in advancing our nation's cybersecurity and infrastructure resilience. I look forward to building on that foundation by fostering collaboration and strengthening resilience across all levels of government and the private sector. Together, through trusted partnerships, transparency, and shared responsibility, we can better manage systemic risks and safeguard the critical functions that ensure our nation's safety and prosperity."""
2025-05-21 02:56:38,"May 19, 2025",Dark Reading,https://www.darkreading.com,https://www.darkreading.com/remote-workforce/legal-aid-agency-data-breach,"Legal Aid Agency Warns Lawyers, Defendants on Data Breach","The online service has since been shut down as the agency grapples with the cyberattack, though it assures the public that those most in need of legal assistance will still be able to access help.
NEWS BRIEFToday, the UK's Legal Aid Agency announced that on April 23 it became aware of a cyberattack on its digital services.The agency is based in London and provides civil and criminal legal aid within England and Wales to assist individuals with their legal issues. It is sponsored by the Ministry of Justice, which is responsible for courts, prisons, probation services, and attendance centers, working closely with other government departments and agencies.The online digital services that were compromised in the cyberattack are what the legal aid providers log their work through and how they receive payment from the government, according to the agency.""The leakage of sensitive data from Legal Aid appears to be significant,"" Max Vetter, vice president of cyber at Immersive Labs, said in emailed commentary. ""The attackers claim to have accessed 2.1 million pieces of data, and with 360,000 applications for legal aid processed in 2023–24, the breach could be extensive.""Since the discovery of the cyberattack, the agency has informed all legal aid providers that some of their personal information, including financial information, may have been compromised. It has also informed the information commissioner and is working alongside the National Crime Agency and the National Cyber Security Center.On May 16, the agency discovered that the attack was ""more extensive than originally understood, and that the group behind it had accessed a large amount of information relating to legal aid applicants.""""We believe the group has accessed and downloaded a significant amount of personal data from those who applied for legal aid through our digital service since 2010,"" the agency added. The compromised data includes addresses, dates of birth, national ID numbers, criminal histories, employment status, and financial data.""The legal sector is built on trust, and clients expect that the personal information they share will remain safe,"" Vetter noted. ""Therefore, when data is stolen, it is hugely damaging. The sector is attractive to cybercriminals because it holds large volumes of highly sensitive and confidential client data. For now, Legal is working quickly to alert consumers who are affected. Clear and actionable communications are essential after a breach, and customers will want strong assurances about the impact on their personal data and the steps they can take to protect themselves from any potential fallout.""The agency is now recommending that individuals who have applied for legal aid during this period take steps to protect themselves by staying alert of any suspicious activity and updating any potentially exposed passwords.The online service has since been taken down, according to Jane Harbottle, CEO of the Legal Aid Agency, though the agency has implemented contingency plans so that ""those most in need of legal support and advice can continue to access the help they need during this time."""
2025-05-21 02:57:15,"May 19, 2025",Dark Reading,https://www.darkreading.com,https://www.darkreading.com/threat-intelligence/cve-disruption-threatens-foundations-defensive-security,CVE Disruption Threatens Foundations of Defensive Security,"If the Common Vulnerabilities and Exposures system continues to face uncertainty, the repercussions will build slowly, and eventually the cracks will become harder to contain.
COMMENTARYThe Common Vulnerabilities and Exposures (CVE) program has been a constant for the cybersecurity community for more than 25 years. Operating behind the scenes, the program has consistently connected the dots between threat research, patching, incident response, and training. Today, it remains fundamental to many of the cybersecurity tools and strategies keeping organizations and critical national infrastructure protected. But now, as its future hangs on a temporary 11-month funding extension, this once-reliable backbone is under pressure. Insecurity in a system like this doesn't make noise. It accumulates in overlooked training, slower coordination, and weaker responses, eroding cyber resilience from the inside out. What Happens When Training Loses Its AnchorDefensive capabilities are only as strong as the scenarios they're built on. For meaningful cybersecurity training to take place, from beginner labs to blue-team exercises or purple-team engagements, the content must reflect real-life vulnerabilities. CVEs facilitate this structure in training environments, anchoring exercises in actual exploits that replicate real-world vulnerabilities with accuracy, demonstrate the tactics, techniques, and procedures (TTPs) that follow, and test how defenders respond. Related:Fake Kling AI Malvertisements Lure Victims With False PromisesWhen CVEs are current and reliable, ATT&CK becomes a living model. It enables training and upskilling to transform from abstract theory into practicality, so, without CVEs, much of that context vanishes. Labs become generic, and very quickly, training becomes outdated. Defenders learn to recognize patterns, but they stay behind the curve. When CVE updates are delayed, this lag shows up in the classroom. Crisis simulation, threat modelling, and defensive security strategies lose relevance. Key vulnerabilities are missing from exercises and lessons fail to evolve. Over time, these blind spots begin to affect real-world outcomes through longer dwell times and missed alerts, and in costly incidents that could have been avoided. The Downstream RisksBeyond training efforts, the sharing of vulnerability intelligence becomes fragmented without a stable CVE framework. This reverberates throughout the entire industry, weakening patching efforts and delaying communications between teams. The risk is, ultimately, that this will undermine coordination across vendors, enterprises, and the broader cybersecurity community. Losing this synchronicity has multiple implications. Delays in sharing vulnerability information lead to missed opportunities to patch critical flaws in a time-effective manner, giving adversaries more opportunities to exploit weaknesses in systems. Related:Large Retailers Land in Scattered Spider's Ransomware WebThe issue also propagates itself across critical industries such as healthcare, finance, and government, where incomplete or inconsistent data is a direct route to significant operational risk. In environments that rely on fast, coordinated action, gaps in vulnerability intelligence make it harder to prioritize threats, align response efforts, or even agree on what's at stake. Instead of working from a common picture of risk, organizations fall back into siloed practices. Security teams make decisions based on partial data, while their counterparts in IT or compliance work from entirely different assumptions. This results in the shared language of risk disappearing, and with it, the cohesion that modern defense strategies depend on. Can AI Bridge the Gap?Soon, artificial intelligence may help streamline triage and assignment without overwhelming humans. In that way, it might offer a path forward, even in a future where long-term funding for CVE coordination is uncertain. But AI is not a replacement for the foundational role that CVEs play. These systems, whether large language models or machine learning tools, are only as effective as the data they're built on, and still require the context offered by human coordination, verification, and transparency. Related:Novel Phishing Attack Combines AES With Poisoned npm PackagesWe cannot expect AI to shoulder the entire weight of global threat communication alone. Without structured, shared vulnerability information, AI output loses its edge. It becomes harder to train models, surface high-risk flaws, or guide intelligent responses. Rather than replacing the CVE program, AI depends on it. A stable, well-defined taxonomy is what gives AI the context it needs to work. Remove that, or let it drift, and the utility of even the smartest system will diminish rapidly. A Fragile Foundation for the Next GenerationThe next generation of cybersecurity professionals is being trained right now. The frameworks they rely on, the vulnerabilities they simulate, the assumptions they carry into practice, all of it is shaped by the availability of context-rich and real-time information. If the CVE system continues to face uncertainty, the repercussions won't be immediate. They will build slowly. And eventually, those cracks become harder to contain. Without the CVE program, we risk losing more than shared identifiers; we risk losing our shared understanding. Avoiding this future means committing to continued investment, governance clarity, and transparency. These are the foundations that keep our readiness strong, our training relevant, and our defenses aligned. This is about keeping the connective tissue intact. Because in cybersecurity, it's the quiet systems that hold everything together. And when they falter, the noise comes later."
2025-05-21 02:57:48,"May 16, 2025",Dark Reading,https://www.darkreading.com,https://www.darkreading.com/cyberattacks-data-breaches/coinbase-extorted-20m-hackers,"Coinbase Extorted, Offers $20M for Info on Its Hackers","Coinbase is going Liam Neeson on its attackers, potentially setting a new precedent for incident response in the wake of crypto- and blockchain-targeting cyberattacks.
Coinbase has set aside $20 million dollars for information that might lead to the arrest of its recent extortionists.On May 11, America's largest cryptocurrency exchange received an unsolicited email. It came from an unknown threat actor, who claimed to possess information about some of the company's internal systems, plus sensitive personally identifying information (PII) belonging to a subset of its customers. The email was deemed credible, Coinbase admitted in an 8-K filing with the Securities and Exchange Commission (SEC) on May 14.Instead of just rolling over, though, the company took an unprecedented step in the history of private sector cyberattacks. It took the $20 million ransom demanded by its cyberattackers and turned it around, now offering it as a reward for any information leading to the threat actors' arrest.""It's an interesting reversal of the usual playbook, transforming breach response into what could turn into a global manhunt,"" Jason Soroko, senior fellow at Sectigo, says. ""This move shifts the narrative from victimhood to proactive offense, weaponizing transparency and financial incentive against cybercriminals. It also signals to users and adversaries alike that extortion will not quietly succeed, potentially reframing how future attacks may be responded to.""Related:Bumblebee Malware Takes Flight via Trojanized VMware UtilityCoinbase Breached in Latest Cryptocurrency HackTo attack the crypto-sphere, what are now the wealthiest cyberattackers in the Web3 space have typically either exploited faults in smart contract code, or taken advantage of companies storing cryptocurrency online (in ""hot wallets""), or combined the two.In contrast, Coinbase's latest incident is rather typical of traditional IT security. As-yet-unidentified attackers recruited customer service agents working for the company overseas, paying them to smuggle information about customers. As Coinbase explained in a new blog post, the attackers' goal was to hoard potential victims for follow-on business impersonation attacks. They also bothered to grab internal company documentation relating to customer service and account management systems.At a certain point, Coinbase's own security apparatus picked up on this insider leakage, firing the employees involved and warning potentially affected customers. Reportedly, less than 1% of its total user base has been impacted, but the information that attackers stole about that small chunk of customers is significant. Login credentials and blockchain private keys were spared, but customers' names, home and email addresses, phone numbers, Social Security numbers (SSNs), masked bank account numbers, images of driver's licenses and passports, and Coinbase account balances and transaction histories were all pilfered.Related:Turkish APT Exploits Chat App Zero-Day to Spy on Iraqi KurdsThe attackers could potentially use this information in highly targeted spear-phishing emails, perhaps focusing on those users they now know are most lucrative. And unlike in traditional payment systems, transactions on the blockchain are irreversible mere minutes after they're executed, even in cases of theft and fraud.Payback: A New Precedent for Cyber Incident Response?Coinbase's attackers demanded tens of millions of dollars to keep the whole story hush-hush. But instead of paying a fortune or ignoring the extortion attempt, the company has allotted that same sum of money to a reward for information that leads to the arrest of the attackers.This decision is essentially without precedent. As Soroko explains, ""most corporate money goes to bug-bounty hunters, not criminal investigations. Microsoft's $250K reward for Conficker's author in 2009 and Binance's $250,000 bounty after its 2018 phishing attempt are all that I can recall. So Coinbase's sum is effectively an order-of-magnitude first.""""The move grabs headlines, reassures customers that extortion won't be met with hush money, and may crowdsource intel that law-enforcement channels miss,"" he says. It might prove an example for future victims of extortion attacks, but there might also be downsides to the approach.Related:Hacktivists Make Little Impact During India-Pakistan ConflictFor instance, Soroko wonders if ""adversaries could retaliate, dump data preemptively, or simply bid the ransom higher.""He adds, ""Other firms with thinner margins may feel pressured to match gestures they cannot fund, turning breach response into a spend-to-save arms race. Paying a tipster who lives in a sanctions-listed country, is part of the crew, or is a corrupt insider risks violating US anti-money-laundering rules, OFAC [Office of Foreign Assets Control] restrictions, and, in some jurisdictions, witness-compensation laws. Boards would also need SEC sign-off if the sum is material.""In the end, he thinks, ""this is a dramatic deterrent in theory, but likely a tactic for big players rather than a repeatable industry standard unless regulators clarify how to do it without tripping over compliance landmines.""Besides the bounty, Coinbase is also planning to reimburse any of its retail customers that have lost money to the cyberattackers. Between these two costs, the expenses involved with investigating and remediating the incident, and other things, Coinbase estimated that the breach will end up costing it somewhere between $180 million and $400 million."
2025-05-21 02:59:07,"May 16, 2025",Dark Reading,https://www.darkreading.com,https://www.darkreading.com/application-security/australian-human-rights-commission-leaks-data-breach,Australian Human Rights Commission Leaks Docs in Data Breach,"An internal error led to public disclosure of reams of sensitive data that could be co-opted for follow-on cyberattacks.
NEWS BRIEFThe Australian Human Rights Commission (AHRC) has published a notice announcing an inadvertent data breach that it discovered on April 10.When the AHRC became aware of the data breach, it found that the incident involved an internal mistake that allowed the unauthorized disclosure of attachments uploaded through the commission's complaint form on its website. This affected complaints filed online from March 24 to April 10, and the documents were available for public access between April 3 and April 10.To boot, roughly a month later, on May 8, the commission became aware that attachments uploaded through the online Web forms (specifically, for its Speaking from Experience Project, Human Rights Awards 20023 nominations, and the National Anti-Racism Framework concept paper) were also affected by the leak. These documents were also made publicly available between April 3 and May 5.A wide variety of personal information may have been caught up in the issue depending on the document, of which roughly 670 were made ""accessible in error."" This includes full names, email addresses, residential addresses, phone numbers, employers, job roles, work contact information, personal health information, school information, religion, and photographs.The AHRC made a point to note that the ""disclosure was not the result of a malicious or criminal attack,"" but that's not to say that victims should breathe easy — the sensitive nature of the leaked data could give any malicious actor that stumbled upon the public cache a treasure trove of data to use in social engineering.The commission has since established a task force to respond to the data breach, and launched an investigation to review the scope of the leak and determine how many people will be affected. It also notified the Office of the Australian Information Commissioner (OAIC) and has since disabled all Web forms on the site.If users believe they may have been affected by the incident, they can contact the commission at the following email: privacy@humanrights.gov.auIn the meantime, the commission recommended that users monitor their online accounts for any unusual or suspicious activity and remain vigilant to scams or malicious links."
